rowid;name;force;level;mechanic;equipment;primaryMuscles;secondaryMuscles;instructions;category;images;id
465;Middle Back Stretch;static;beginner;isolation;;"[""middle back""]";"[""abdominals""; ""lats""; ""lower back""]";"[""Stand so your feet are shoulder width apart and your hands are on your hips.""; ""Twist at your waist until you feel a stretch. Hold for 10 to 15 seconds; then twist to the other side.""]";stretching;"[""Middle_Back_Stretch/0.jpg""; ""Middle_Back_Stretch/1.jpg""]";Middle_Back_Stretch
476;Neck-SMR;static;intermediate;;other;"[""neck""]";[];"[""Using a muscle roller or a rolling pin; place the roller behind your head and against your neck. Make sure that you do not place the roller directly against the spine; but turned slightly so that the roller is pressed against the muscles to either side of the spine. This will be your starting position.""; ""Starting at the top of your neck; slowly roll down the muscles of your neck; pausing at points of tension for 10-30 seconds.""]";stretching;"[""Neck-SMR/0.jpg""; ""Neck-SMR/1.jpg""]";Neck-SMR
481;On-Your-Back Quad Stretch;static;beginner;isolation;other;"[""quadriceps""]";[];"[""Lie on a flat bench or step; and hang one leg and arm over the side.""; ""Bend the knee and hold the top of the foot. As you do this; be careful not to arch your lower back.""; ""Pull the belly button to the spine to stay in neutral. Press your foot down and into your hand. To add the hip stretch; lift the hip of the leg you're holding up toward the ceiling.""; ""Switch sides.""]";stretching;"[""On-Your-Back_Quad_Stretch/0.jpg""; ""On-Your-Back_Quad_Stretch/1.jpg""]";On-Your-Back_Quad_Stretch
482;On Your Side Quad Stretch;static;beginner;isolation;;"[""quadriceps""]";[];"[""Start off by lying on your right side; with your right knee bent at a 90-degree angle resting on the floor in front of you (this stabilizes the torso).""; ""Bend your left knee behind you and hold your left foot with your left hand. To stretch your hip flexor; press your left hip forward as you push your left foot back into your hand. Switch sides.""]";stretching;"[""On_Your_Side_Quad_Stretch/0.jpg""; ""On_Your_Side_Quad_Stretch/1.jpg""]";On_Your_Side_Quad_Stretch
506;One Arm Against Wall;static;beginner;isolation;;"[""lats""]";[];"[""From a standing position; place a bent arm against a wall or doorway.""; ""Slowly lean toward your arm until you feel a stretch in your lats.""]";stretching;"[""One_Arm_Against_Wall/0.jpg""; ""One_Arm_Against_Wall/1.jpg""]";One_Arm_Against_Wall
514;One Half Locust;static;beginner;;;"[""quadriceps""]";"[""abdominals""; ""biceps""; ""chest""]";"[""Lie facedown on the floor.""; ""Put your left hand under your left hipbone to pad your hip and pubic bone.""; ""Bend your right knee so you can hold the foot in your right hand.""; ""Lift the foot in the air and simultaneously lift your shoulders off the floor. This also stretches the right hip flexor and the chest and shoulders. Switch sides. If it doesn't bother your back; you can try it with both arms and legs at the same time.""]";stretching;"[""One_Half_Locust/0.jpg""; ""One_Half_Locust/1.jpg""]";One_Half_Locust
515;One Handed Hang;static;beginner;;other;"[""lats""]";"[""biceps""]";"[""Grab onto a chinup bar with one hand; using a pronated grip. Keep your feet on the floor or a step. Allow the majority of your weight to hang from that hand; while keeping your feet on the ground. Hold for 10-20 seconds and switch sides.""]";stretching;"[""One_Handed_Hang/0.jpg""; ""One_Handed_Hang/1.jpg""]";One_Handed_Hang
516;One Knee To Chest;static;beginner;compound;;"[""glutes""]";"[""hamstrings""; ""lower back""]";"[""Start off by lying on the floor.""; ""Extend one leg straight and pull the other knee to your chest. Hold under the knee joint to protect the kneecap.""; ""Gently tug that knee toward your nose.""; ""Switch sides. This stretches the buttocks and lower back of the bent leg and the hip flexor of the straight leg.""]";stretching;"[""One_Knee_To_Chest/0.jpg""; ""One_Knee_To_Chest/1.jpg""]";One_Knee_To_Chest
521;Overhead Lat;static;expert;;other;"[""lats""]";"[""triceps""]";"[""Sit upright on the floor with your partner behind you. Raise one arm straight up; and flex the elbow; attempting to touch your hand to your back. Your parner should hold your tricep and wrist. This will be your starting position.""; ""Attempt to pull your upper arm to your side as your partner prevents you from doing actually doing so.""; ""After 10-20 seconds; relax the arm and allow your partner to further stretch the lat by applying gentle pressure to the tricep. Hold for 10-20 seconds; and then switch sides.""]";stretching;"[""Overhead_Lat/0.jpg""; ""Overhead_Lat/1.jpg""]";Overhead_Lat
524;Overhead Stretch;static;beginner;compound;;"[""abdominals""]";"[""chest""; ""forearms""; ""lats""; ""triceps""]";"[""Standing straight up; lace your fingers together and open your palms to the ceiling. Keep your shoulders down as you extend your arms up.""; ""To create a full torso stretch; pull your tailbone down and stabilize your torso as you do this. Stretch the muscles on both the front and the back of the torso.""]";stretching;"[""Overhead_Stretch/0.jpg""; ""Overhead_Stretch/1.jpg""]";Overhead_Stretch
525;Overhead Triceps;static;expert;;body only;"[""triceps""]";"[""lats""]";"[""Sit upright on the floor with your partner behind you. Raise one arm straight up; and flex the elbow; attempting to touch your hand to your back. Your parner should hold your elbow and wrist. This will be your starting position.""; ""Attempt to extend the arm straight into the air as your partner prevents you from doing actually doing so.""; ""After 10-20 seconds; relax the arm and allow your partner to further stretch the tricep by applying gentle pressure to the wrist. Hold for 10-20 seconds; and then switch sides.""]";stretching;"[""Overhead_Triceps/0.jpg""; ""Overhead_Triceps/1.jpg""]";Overhead_Triceps
533;Pelvic Tilt Into Bridge;static;intermediate;compound;;"[""lower back""]";[];"[""Lie down with your feet on the floor; heels directly under your knees.""; ""Lift only your tailbone to the ceiling to stretch your lower back. (Don't lift the entire spine yet.) Pull in your stomach.""; ""To go into a bridge; lift the entire spine except the neck.""]";stretching;"[""Pelvic_Tilt_Into_Bridge/0.jpg""; ""Pelvic_Tilt_Into_Bridge/1.jpg""]";Pelvic_Tilt_Into_Bridge
534;Peroneals-SMR;static;intermediate;;foam roll;"[""calves""]";[];"[""Lay on your side; supporting your weight on your forearm and on a foam roller placed on the outside of your lower leg. Your upper leg can either be on top of your lower leg; or you can cross it in front of you. This will be your starting position.""; ""Raise your hips off of the ground and begin to roll from below the knee to above the ankle on the side of your leg; pausing at points of tension for 10-30 seconds. Repeat on the other leg.""]";stretching;"[""Peroneals-SMR/0.jpg""; ""Peroneals-SMR/1.jpg""]";Peroneals-SMR
535;Peroneals Stretch;static;intermediate;;other;"[""calves""]";[];"[""In a seated position; loop a belt; rope; or band around one foot. This will be your starting position.""; ""With the leg extended and the heel off of the ground; pull on the belt so that the foot is inverted; with the inside of the foot being pulled towards you. Hold for 10-20 seconds; and then switch sides.""]";stretching;"[""Peroneals_Stretch/0.jpg""; ""Peroneals_Stretch/1.jpg""]";Peroneals_Stretch
538;Piriformis-SMR;static;intermediate;isolation;foam roll;"[""glutes""]";[];"[""Sit with your buttocks on top of a foam roll. Bend your knees; and then cross one leg so that the ankle is over the knee. This will be your starting position.""; ""Shift your weight to the side of the crossed leg; rolling over the buttocks until you feel tension in your upper glute. You may assist the stretch by using one hand to pull the bent knee towards your chest. Hold this position for 10-30 seconds; and then switch sides.""]";stretching;"[""Piriformis-SMR/0.jpg""; ""Piriformis-SMR/1.jpg""]";Piriformis-SMR
539;Plank;static;beginner;isolation;body only;"[""abdominals""]";[];"[""Get into a prone position on the floor; supporting your weight on your toes and your forearms. Your arms are bent and directly below the shoulder.""; ""Keep your body straight at all times; and hold this position as long as possible. To increase difficulty; an arm or leg can be raised.""]";strength;"[""Plank/0.jpg""; ""Plank/1.jpg""]";Plank
540;Plate Pinch;static;intermediate;isolation;other;"[""forearms""]";[];"[""Grab two wide-rimmed plates and put them together with the smooth sides facing outward""; ""Use your fingers to grip the outside part of the plate and your thumb for the other side thus holding both plates together. This is the starting position.""; ""Squeeze the plate with your fingers and thumb. Hold this position for as long as you can.""; ""Repeat for the recommended amount of sets prescribed in your program.""; ""Switch arms and repeat the movements.""]";strength;"[""Plate_Pinch/0.jpg""; ""Plate_Pinch/1.jpg""]";Plate_Pinch
546;Posterior Tibialis Stretch;static;intermediate;;other;"[""calves""]";[];"[""In a seated position; loop a belt; rope; or band around one foot. This will be your starting position.""; ""With the leg extended and the heel off of the ground; pull on the belt so that the foot is everted; with the outside of the foot being pulled towards you. Hold for 10-20 seconds; and then switch sides.""]";stretching;"[""Posterior_Tibialis_Stretch/0.jpg""; ""Posterior_Tibialis_Stretch/1.jpg""]";Posterior_Tibialis_Stretch
557;Prone Manual Hamstring;static;beginner;isolation;;"[""hamstrings""]";[];"[""You will need a partner for this exercise. Lay face down with your legs straight. Your assistant will place their hand on your heel.""; ""To begin; flex the knee to curl your leg up. Your partner should provide resistance; starting light and increasing the pressure as the movement is completed. Communicate with your partner to monitor appropriate resistance levels.""; ""Pause at the top; returning the leg to the starting position as your partner provides resistance going the other direction.""]";strength;"[""Prone_Manual_Hamstring/0.jpg""; ""Prone_Manual_Hamstring/1.jpg""]";Prone_Manual_Hamstring
570;Pyramid;static;beginner;;exercise ball;"[""lower back""]";"[""shoulders""]";"[""Start off by rolling your torso forward onto the ball so your hips rest on top of the ball and become the highest point of your body.""; ""Rest your hands and feet on the floor. Your arms and legs can be slightly bent or straight; depending on the size of the ball; your flexibility; and the length of your limbs. This also helps develop stabilizing strength in your torso and shoulders.""]";stretching;"[""Pyramid/0.jpg""; ""Pyramid/1.jpg""]";Pyramid
571;Quad Stretch;static;intermediate;;other;"[""quadriceps""]";[];"[""Lay on your side. Loop a belt; rope; or band around your top foot. Flex the knee and extend your hip; attempting to touch your glutes with your foot; and holding the belt with your hands. This will be your starting position.""; ""With the belt being held over the shoulder or overhead; gently pull to increase the stretch in the quadriceps. Hold for 10-20 seconds; and then switch sides.""]";stretching;"[""Quad_Stretch/0.jpg""; ""Quad_Stretch/1.jpg""]";Quad_Stretch
572;Quadriceps-SMR;static;intermediate;isolation;foam roll;"[""quadriceps""]";[];"[""Lay facedown on the floor with your weight supported by your hands or forearms. Place a foam roll underneath one leg on the quadriceps; and keep the foot off of the ground. Make sure to relax the leg as much as possible. This will be your starting position.""; ""Shifting as much weight onto the leg to be stretched as is tolerable; roll over the foam from above the knee to below the hip; holding points of tension for 10-30 seconds. Switch sides.""]";stretching;"[""Quadriceps-SMR/0.jpg""; ""Quadriceps-SMR/1.jpg""]";Quadriceps-SMR
597;Rhomboids-SMR;static;intermediate;;foam roll;"[""middle back""]";"[""traps""]";"[""Lay down with your back on the floor. Place a foam roll underneath your upper back; and cross your arms in front of you; protracting your shoulders. This will be your starting position.""; ""Raise your hips off of the ground; placing your weight onto the foam roll. Shift your weight to one side at a time; rolling over your middle and upper back. Pause at points of tension for 10-30 seconds.""]";stretching;"[""Rhomboids-SMR/0.jpg""; ""Rhomboids-SMR/1.jpg""]";Rhomboids-SMR
610;Round The World Shoulder Stretch;static;beginner;;other;"[""shoulders""]";"[""biceps""; ""chest""]";"[""Stand up straight with your legs together; holding a bodybar or broomstick.""; ""Hold the pole behind your hips with a wider than shoulder width grip. Your palms should be down and your thumbs facing out.""; ""Slowly lift your arms up behind your head. Don't force it if it gets hard to lift further.""]";stretching;"[""Round_The_World_Shoulder_Stretch/0.jpg""; ""Round_The_World_Shoulder_Stretch/1.jpg""]";Round_The_World_Shoulder_Stretch
612;Runner's Stretch;static;beginner;;;"[""hamstrings""]";"[""calves""]";"[""It's easiest to get into this stretch if you start standing up; put one leg behind you; and slowly lower your torso down to the floor.""; ""Keep the front heel on the floor (if it lifts up; scoot your other leg further back).""; ""Place your hands on either side of your front leg. To get more out of this stretch; push your butt up toward the ceiling; and then gradually lower it back toward the floor. You'll Stretch the hip flexor of the back leg and the hamstring and buttocks of the front.""]";stretching;"[""Runners_Stretch/0.jpg""; ""Runners_Stretch/1.jpg""]";Runners_Stretch
625;Seated Biceps;static;expert;isolation;body only;"[""biceps""]";"[""chest""; ""shoulders""]";"[""Sit on the floor with your knees bent and your partner standing behind you. Extend your arms straight behind you with your palms facing each other. Your partner will hold your wrists for you. This will be the starting position.""; ""Attempt to flex your elbows; while your partner prevents any actual movement.""; ""After 10-20 seconds; relax your arms while your partner gently pulls your wrists up to stretch your biceps. Be sure to let your partner know when the stretch is appropriate to prevent injury or overstretching.""]";stretching;"[""Seated_Biceps/0.jpg""; ""Seated_Biceps/1.jpg""]";Seated_Biceps
629;Seated Calf Stretch;static;beginner;;;"[""calves""]";"[""hamstrings""; ""lower back""]";"[""Sit up straight on an exercise mat.""; ""Bend one knee and put that foot on the floor to stabilize the torso.""; ""Straighten your other leg and flex your ankle.""; ""Using a band; towel; or your hand if you can reach; pull the toes toward you. Hold for 10 to 20 seconds; then switch sides.""]";stretching;"[""Seated_Calf_Stretch/0.jpg""; ""Seated_Calf_Stretch/1.jpg""]";Seated_Calf_Stretch
637;Seated Floor Hamstring Stretch;static;beginner;;;"[""hamstrings""]";"[""calves""]";"[""Sit on a mat with your right leg extended in front of you and your left leg bent with your foot against your right inner thigh.""; ""Lean forward from your hips and reach for your ankle until you feel a stretch in your hamstring. Hold for 15 seconds; then repeat for your other side.""]";stretching;"[""Seated_Floor_Hamstring_Stretch/0.jpg""; ""Seated_Floor_Hamstring_Stretch/1.jpg""]";Seated_Floor_Hamstring_Stretch
638;Seated Front Deltoid;static;expert;;body only;"[""shoulders""]";"[""chest""]";"[""Sit upright on the floor with your legs bent; your partner standing behind you. Stick your arms straight out to your sides; with your palms facing the ground. Attempt to move them as far behind you as possible; as your assistant holds your wrists. This will be your starting position.""; ""Keeping your elbows straight; attempt to move your arms to the front; with your partner gently restraining you to prevent any actual movement for 10-20 seconds.""; ""Now; relax your muscles and allow your partner to gently increase the stretch on the shoulders and chest. Hold for 10 to 20 seconds.""]";stretching;"[""Seated_Front_Deltoid/0.jpg""; ""Seated_Front_Deltoid/1.jpg""]";Seated_Front_Deltoid
639;Seated Glute;static;expert;;body only;"[""glutes""]";"[""adductors""]";"[""In a seated position with your knees bent; cross one ankle over the opposite knee. Your partner will stand behind you. Now; lean forward as your partner braces your shoulders with their hands. This will be your starting position.""; ""Attempt to push your torso back for 10-20 seconds; as your partner prevents any actual movement of your torso.""; ""Now relax your muscles as your partner increases the stretch by gently pushing your torso forward for 10-20 seconds.""]";stretching;"[""Seated_Glute/0.jpg""; ""Seated_Glute/1.jpg""]";Seated_Glute
641;Seated Hamstring;static;expert;;;"[""hamstrings""]";"[""calves""]";"[""In a seated position with your legs extended; have your partner stand behind you. Now; lean forward as your partner braces your shoulders with their hands. This will be your starting position.""; ""Attempt to push your torso back for 10-20 seconds; as your partner prevents any actual movement of your torso.""; ""Now relax your muscles as your partner increases the stretch by gently pushing your torso forward for 10-20 seconds.""]";stretching;"[""Seated_Hamstring/0.jpg""; ""Seated_Hamstring/1.jpg""]";Seated_Hamstring
642;Seated Hamstring and Calf Stretch;static;intermediate;;other;"[""hamstrings""]";"[""calves""]";"[""Loop a belt; rope; or band around one foot. Sit down with both legs extended . This will be your starting position.""; ""Leaning forward slightly; pull on the belt to draw the toes of your foot back. Hold this position for 10-20 seconds and then repeat with the other leg.""]";stretching;"[""Seated_Hamstring_and_Calf_Stretch/0.jpg""; ""Seated_Hamstring_and_Calf_Stretch/1.jpg""]";Seated_Hamstring_and_Calf_Stretch
649;Seated Overhead Stretch;static;beginner;isolation;;"[""abdominals""]";[];"[""Sit up straight on an exercise mat.""; ""Touch the soles of your feet together with your feet six to eight inches in front of your hips.""; ""Place one hand on the floor beside you and your other hand behind your head.""; ""Lift your elbow to the ceiling as you incline your torso to the other side. Hold for 10 to 20 seconds; then switch sides.""]";stretching;"[""Seated_Overhead_Stretch/0.jpg""; ""Seated_Overhead_Stretch/1.jpg""]";Seated_Overhead_Stretch
661;Side-Lying Floor Stretch;static;beginner;;;"[""lats""]";[];"[""First lie on your left side; bending your left knee in front of you to stabilize your torso (use your abdominal muscles as well to hold you upright).""; ""Straighten your right leg and rest the right foot on the floor behind your left. Straighten your right arm over your head and gently pull on your right wrist to stretch the entire right side of the body. Switch sides.""]";stretching;"[""Side-Lying_Floor_Stretch/0.jpg""; ""Side-Lying_Floor_Stretch/1.jpg""]";Side-Lying_Floor_Stretch
662;Side Bridge;static;beginner;;body only;"[""abdominals""]";"[""shoulders""]";[];strength;"[""Side_Bridge/0.jpg""; ""Side_Bridge/1.jpg""]";Side_Bridge
668;Side Lying Groin Stretch;static;beginner;isolation;;"[""adductors""]";"[""hamstrings""]";"[""Start off by lying on your right side and bend your right knee in front of you to stabilize the torso.""; ""Rest your head on your right hand or shoulder. Lift your left leg upward and hold it by the back of the knee (easier) or the foot (harder).""; ""Pull your left knee in toward your left shoulder and simultaneously press your foot or knee down to the floor. To intensify this stretch; straighten your left leg. Switch sides.""]";stretching;"[""Side_Lying_Groin_Stretch/0.jpg""; ""Side_Lying_Groin_Stretch/1.jpg""]";Side_Lying_Groin_Stretch
669;Side Neck Stretch;static;beginner;isolation;;"[""neck""]";[];"[""Start with your shoulders relaxed; gently tilt your head towards your shoulder.""; ""Assist stretch with a gentle pull on the side of the head.""]";stretching;"[""Side_Neck_Stretch/0.jpg""; ""Side_Neck_Stretch/1.jpg""]";Side_Neck_Stretch
672;Side Wrist Pull;static;beginner;isolation;;"[""shoulders""]";"[""forearms""; ""lats""]";"[""This stretch works best standing. Cross your left arm over the midline of your body and hold the left wrist in your right hand down at the level of your hips. Start the stretch with a bent left arm.""; ""Slowly straighten; pull; and lift it up to shoulder height; as pictured. Feel this stretch originate in your back; not your shoulders; and don't pull too hard on the shoulders joint. Switch sides.""]";stretching;"[""Side_Wrist_Pull/0.jpg""; ""Side_Wrist_Pull/1.jpg""]";Side_Wrist_Pull
728;Spinal Stretch;static;beginner;isolation;;"[""middle back""]";"[""lats""; ""lower back""; ""neck""; ""traps""]";"[""Sit in a chair so your back is straight and your feet planted on the floor.""; ""Interlace your fingers behind your head; elbows out and your chin down.""; ""Twist your upper body to one side about 3 times as far as you can. Then lean forward and twist your torso to reach your elbow to the floor on the inside of your knee.""; ""Return to upright position and then repeat for your other side.""]";stretching;"[""Spinal_Stretch/0.jpg""; ""Spinal_Stretch/1.jpg""]";Spinal_Stretch
747;Standing Biceps Stretch;static;beginner;isolation;other;"[""biceps""]";"[""chest""; ""shoulders""]";"[""Clasp your hands behind your back with your palms together; straighten arms and then rotate them so your palms face downward.""; ""Raise your arms up and hold until you feel a stretch in your biceps.""]";stretching;"[""Standing_Biceps_Stretch/0.jpg""; ""Standing_Biceps_Stretch/1.jpg""]";Standing_Biceps_Stretch
760;Standing Elevated Quad Stretch;static;beginner;;other;"[""quadriceps""]";[];"[""Start by standing with your back about two to three feet away from a bench or step.""; ""Lift one leg behind you and rest your foot on the step;either on your instep or the ball of your foot; whichever you find most comfortable.""; ""Keep your supporting knee slightly bent and avoid letting that knee extend out beyond your toes. Switch sides.""]";stretching;"[""Standing_Elevated_Quad_Stretch/0.jpg""; ""Standing_Elevated_Quad_Stretch/1.jpg""]";Standing_Elevated_Quad_Stretch
762;Standing Gastrocnemius Calf Stretch;static;beginner;;;"[""calves""]";"[""hamstrings""]";"[""Place your right heel on a step with your knee extended and lean forward to grab your right toe with your right hand. Your left knee should be slightly bent and your back should be straight.""; ""Support your weight on your left leg and place your left hand on your left thigh.""; ""Pull your right toes toward your knee until you feel a stretch in your calf.""]";stretching;"[""Standing_Gastrocnemius_Calf_Stretch/0.jpg""; ""Standing_Gastrocnemius_Calf_Stretch/1.jpg""]";Standing_Gastrocnemius_Calf_Stretch
763;Standing Hamstring and Calf Stretch;static;beginner;;other;"[""hamstrings""]";[];"[""Being by looping a belt; band; or rope around one foot. While standing; place that foot forward.""; ""Bend your back leg; while keeping the front one straight. Now raise the toes of your front foot off of the ground and lean forward.""; ""Using the belt; pull on the top of the foot to increase the stretch in the calf. Hold for 10-20 seconds and repeat with the other foot.""]";stretching;"[""Standing_Hamstring_and_Calf_Stretch/0.jpg""; ""Standing_Hamstring_and_Calf_Stretch/1.jpg""]";Standing_Hamstring_and_Calf_Stretch
765;Standing Hip Flexors;static;beginner;isolation;;"[""quadriceps""]";[];"[""Stand up straight with the spine vertical; the left foot slightly in front of the right.""; ""Bend both knees and lift the back heel off the floor as you press the right hip forward. You can't get a thorough; deep stretch in this position; however; because it's hard to relax the hip flexor and stand on it at the same time. Switch sides.""]";stretching;"[""Standing_Hip_Flexors/0.jpg""; ""Standing_Hip_Flexors/1.jpg""]";Standing_Hip_Flexors
767;Standing Lateral Stretch;static;beginner;;;"[""abdominals""]";[];"[""Take a slightly wider than hip distance stance with your knees slightly bent.""; ""Place your right hand on your right hip to support the spine.""; ""Raise your left arm in a vertical line and place your left hand behind your head. Keep it there as you incline your torso to the right.""; ""Keep your weight evenly distributed between both legs (don't lean into your left hip). Switch sides.""]";stretching;"[""Standing_Lateral_Stretch/0.jpg""; ""Standing_Lateral_Stretch/1.jpg""]";Standing_Lateral_Stretch
773;Standing Olympic Plate Hand Squeeze;static;beginner;isolation;other;"[""forearms""]";"[""biceps""]";"[""To begin; stand straight while holding a weight plate by the ridge at arm's length in each hand using a neutral grip (palms facing in). You feet should be shoulder width apart from each other. This will be your starting position.""; ""Lower the plates until the fingers are nearly extended but can still hold weights. Inhale as you lower the plates.""; ""Now raise the plates back to the starting position as you exhale by closing your hands.""; ""Repeat for the recommended amount of repetitions prescribed in your program.""]";strength;"[""Standing_Olympic_Plate_Hand_Squeeze/0.jpg""; ""Standing_Olympic_Plate_Hand_Squeeze/1.jpg""]";Standing_Olympic_Plate_Hand_Squeeze
781;Standing Pelvic Tilt;static;beginner;isolation;;"[""lower back""]";"[""glutes""]";"[""Start off with your feet hip-distance apart.""; ""Bend your knees slightly to keep them soft and springy.""; ""You may want to move your pelvis forward and backward and back few times before holding the tailbone forward in this stretch.""]";stretching;"[""Standing_Pelvic_Tilt/0.jpg""; ""Standing_Pelvic_Tilt/1.jpg""]";Standing_Pelvic_Tilt
