rowid;name;force;level;mechanic;equipment;primaryMuscles;secondaryMuscles;instructions;category;images;id
783;Standing Soleus And Achilles Stretch;static;beginner;isolation;;"[""calves""]";[];"[""Stand with your feet hip-distance apart; one foot slightly in front of the other.""; ""Bend both knees; keeping your back heel on the floor. Switch sides.""]";stretching;"[""Standing_Soleus_And_Achilles_Stretch/0.jpg""; ""Standing_Soleus_And_Achilles_Stretch/1.jpg""]";Standing_Soleus_And_Achilles_Stretch
784;Standing Toe Touches;static;beginner;;;"[""hamstrings""]";"[""calves""]";"[""Stand with some space in front and behind you.""; ""Bend at the waist; keeping your legs straight; until you can relax and let your upper body hang down in front of you. Let your arms and hands hang down naturally. Hold for 10 to 20 seconds.""]";stretching;"[""Standing_Toe_Touches/0.jpg""; ""Standing_Toe_Touches/1.jpg""]";Standing_Toe_Touches
793;Stomach Vacuum;static;beginner;isolation;body only;"[""abdominals""]";[];"[""To begin; stand straight with your feet shoulder width apart from each other. Place your hands on your hips. This is the starting position.""; ""Now slowly inhale as much air as possible and then start to exhale as much as possible while bringing your stomach in as much as possible and hold this position. Try to visualize your navel touching your backbone.""; ""One isometric contraction is around 20 seconds. During the 20 second hold; try to breathe normally. Then inhale and bring your stomach back to the starting position.""; ""Once you have practiced this exercise; try to perform this exercise for longer than 20 seconds. Tip: You can work your way up to 40-60 seconds.""; ""Repeat for the recommended amount of sets.""]";stretching;"[""Stomach_Vacuum/0.jpg""; ""Stomach_Vacuum/1.jpg""]";Stomach_Vacuum
802;Superman;static;beginner;compound;body only;"[""lower back""]";"[""glutes""; ""hamstrings""]";"[""To begin; lie straight and face down on the floor or exercise mat. Your arms should be fully extended in front of you. This is the starting position.""; ""Simultaneously raise your arms; legs; and chest off of the floor and hold this contraction for 2 seconds. Tip: Squeeze your lower back to get the best results from this exercise. Remember to exhale during this movement. Note: When holding the contracted position; you should look like superman when he is flying.""; ""Slowly begin to lower your arms; legs and chest back down to the starting position while inhaling.""; ""Repeat for the recommended amount of repetitions prescribed in your program.""]";stretching;"[""Superman/0.jpg""; ""Superman/1.jpg""]";Superman
814;The Straddle;static;beginner;;;"[""hamstrings""]";"[""adductors""; ""calves""]";"[""Begin in a seated; upright position. Start by extending your legs in front of you in a V.""; ""With your hands on the floor; lean forward as far as possible. Hold for 10 to 20 seconds.""]";stretching;"[""The_Straddle/0.jpg""; ""The_Straddle/1.jpg""]";The_Straddle
823;Tricep Side Stretch;static;beginner;;;"[""triceps""]";"[""shoulders""]";"[""Bring right arm across your body and over your left shoulder; holding your elbow with your left hand; until you feel a stretch in your tricep. Then repeat for your other arm.""]";stretching;"[""Tricep_Side_Stretch/0.jpg""; ""Tricep_Side_Stretch/1.jpg""]";Tricep_Side_Stretch
828;Triceps Stretch;static;beginner;isolation;;"[""triceps""]";"[""lats""]";"[""Reach your hand behind your head; grasp your elbow and gently pull. Hold for 10 to 20 seconds; then switch sides.""]";stretching;"[""Triceps_Stretch/0.jpg""; ""Triceps_Stretch/1.jpg""]";Triceps_Stretch
836;Upper Back-Leg Grab;static;beginner;;;"[""hamstrings""]";"[""lower back""; ""middle back""]";"[""While seated; bend forward to hug your thighs from underneath with both arms.""; ""Keep your knees together and your legs extended out as you bring your chest down to your knees. You can also stretch your middle back by pulling your back away from your knees as your hugging them.""]";stretching;"[""Upper_Back-Leg_Grab/0.jpg""; ""Upper_Back-Leg_Grab/1.jpg""]";Upper_Back-Leg_Grab
837;Upper Back Stretch;static;beginner;;;"[""middle back""]";"[""middle back""]";"[""Clasp fingers together with your thumbs pointing down; round your shoulders as you reach your hands forward.""]";stretching;"[""Upper_Back_Stretch/0.jpg""; ""Upper_Back_Stretch/1.jpg""]";Upper_Back_Stretch
841;Upward Stretch;static;beginner;;;"[""shoulders""]";"[""chest""; ""lats""]";"[""Extend both hands straight above your head; palms touching.""; ""Slowly push your hands up and back; keeping your back straight.""]";stretching;"[""Upward_Stretch/0.jpg""; ""Upward_Stretch/1.jpg""]";Upward_Stretch
866;World's Greatest Stretch;static;intermediate;;;"[""hamstrings""]";"[""calves""; ""glutes""; ""quadriceps""]";"[""This is a three-part stretch. Begin by lunging forward; with your front foot flat on the ground and on the toes of your back foot. With your knees bent; squat down until your knee is almost touching the ground. Keep your torso erect; and hold this position for 10-20 seconds.""; ""Now; place the arm on the same side as your front leg on the ground; with the elbow next to the foot. Your other hand should be placed on the ground; parallel to your lead leg; to help support you during this portion of the stretch.""; ""After 10-20 seconds; place your hands on either side of your front foot. Raise the toes of the front foot off of the ground; and straighten your leg. You may need to reposition your rear leg to do so. Hold for 10-20 seconds; and then repeat the entire sequence for the other side.""]";stretching;"[""Worlds_Greatest_Stretch/0.jpg""; ""Worlds_Greatest_Stretch/1.jpg""]";Worlds_Greatest_Stretch
